{
  "$schema": "https://json-schema.org/draft/2020-12/schema",
  "$id": "https://github.com/ChelseaKR/ca-fish-planting-alerts/schema/snapshot.v1.json",
  "title": "ca-fish-planting-alerts snapshot v1",
  "description": "One static file, regenerated by the pipeline, holding every plant the pipeline has ever observed on CDFW's Fish Planting Schedule, per water. A plant is a WEEK (Sunday..Saturday), never a day: CDFW publishes week-of granularity only. Consumers must never render a plant as a single date.",
  "type": "object",
  "additionalProperties": false,
  "required": [
    "schema_version", "generated_at", "source", "source_week", "attribution", "licence",
    "regions", "counties", "species", "waters", "this_week", "coverage"
  ],
  "properties": {
    "schema_version": { "const": 1 },
    "generated_at": { "$ref": "#/$defs/datetime", "description": "When the pipeline built this file (UTC)." },
    "source": {
      "type": "object",
      "additionalProperties": false,
      "required": ["name", "url", "fetched_at", "stated_today", "stated_period", "content_sha256"],
      "properties": {
        "name": { "const": "CDFW Fish Planting Schedule" },
        "url": { "const": "https://nrm.dfg.ca.gov/FishPlants/PublicPlantSearch" },
        "fetched_at": { "$ref": "#/$defs/datetime", "description": "When the source page was fetched (UTC). The page is fetched at most once per run." },
        "stated_today": { "$ref": "#/$defs/date", "description": "The date the page itself says is 'today' (the end of its 'Past Plants' period). Freshness is judged from this, not from HTTP headers; a page whose stated_today is more than 7 days behind the run date is refused and no snapshot is built." },
        "stated_period": { "$ref": "#/$defs/week_like", "description": "The page's own 'All Plants (start - end)' window. Rows outside it are impossible; weeks that fall out of it age out of the page but never out of this file." },
        "content_sha256": { "type": "string", "pattern": "^[0-9a-f]{64}$", "description": "SHA-256 of the fetched HTML, for reproducibility." }
      }
    },
    "source_week": {
      "$ref": "#/$defs/week",
      "description": "The CDFW week (Sunday..Saturday) that contains source.stated_today. 'This week' everywhere means this week."
    },
    "attribution": {
      "type": "object",
      "additionalProperties": false,
      "required": ["text", "url"],
      "properties": {
        "text": { "type": "string", "minLength": 1, "description": "Show this verbatim wherever data from this file is displayed." },
        "url": { "type": "string", "format": "uri" }
      }
    },
    "licence": {
      "type": "object",
      "additionalProperties": false,
      "required": ["summary", "sources"],
      "properties": {
        "summary": { "type": "string", "minLength": 1 },
        "sources": {
          "type": "array",
          "minItems": 1,
          "items": {
            "type": "object",
            "additionalProperties": false,
            "required": ["name", "url", "terms_url", "terms_read_on", "commercial_reuse", "attribution_required"],
            "properties": {
              "name": { "type": "string" },
              "url": { "type": "string", "format": "uri" },
              "terms_url": { "type": "string", "format": "uri" },
              "terms_read_on": { "$ref": "#/$defs/date" },
              "commercial_reuse": { "enum": ["permitted", "not-permitted", "unknown"] },
              "attribution_required": { "type": "boolean" }
            }
          }
        }
      }
    },
    "regions": {
      "type": "array",
      "minItems": 6,
      "items": {
        "type": "object",
        "additionalProperties": false,
        "required": ["code", "name"],
        "properties": {
          "code": { "$ref": "#/$defs/region_code" },
          "name": { "type": "string", "minLength": 1 }
        }
      }
    },
    "counties": {
      "type": "array",
      "minItems": 58,
      "items": {
        "type": "object",
        "additionalProperties": false,
        "required": ["name", "region"],
        "properties": {
          "name": { "type": "string", "minLength": 1 },
          "region": { "$ref": "#/$defs/region_code" }
        }
      }
    },
    "species": {
      "type": "array",
      "minItems": 1,
      "uniqueItems": true,
      "items": { "type": "string", "minLength": 1 },
      "description": "Every species string ever observed, verbatim from CDFW (today: 'Trout', 'Catfish')."
    },
    "waters": {
      "type": "array",
      "minItems": 1,
      "items": { "$ref": "#/$defs/water" },
      "description": "Every water with at least one observed plant, sorted by id. Waters CDFW lists but has never planted in the observed window are not included."
    },
    "this_week": {
      "type": "array",
      "items": {
        "type": "object",
        "additionalProperties": false,
        "required": ["water_id", "species"],
        "properties": {
          "water_id": { "$ref": "#/$defs/water_id" },
          "species": { "type": "string" }
        }
      },
      "description": "Convenience index: plants whose week == source_week and whose status is 'listed'. Derived from waters[].plants; the pipeline tests that the two agree. May be empty on a fresh, valid page (a real 'no plants this week'); it is never emitted from a stale or failed fetch because no snapshot is built then."
    },
    "coverage": {
      "type": "object",
      "additionalProperties": false,
      "required": ["waters_this_week", "waters_known", "waters_with_history", "names_matched", "names_seen", "rows_parsed", "weeks_of_history_min", "weeks_of_history_median"],
      "properties": {
        "waters_this_week": { "type": "integer", "minimum": 0 },
        "waters_known": { "type": "integer", "minimum": 0, "description": "Waters in CDFW's own water list on the page (895 on 2026-09-13)." },
        "waters_with_history": { "type": "integer", "minimum": 0 },
        "names_matched": { "type": "integer", "minimum": 0, "description": "Distinct (stock id, published name) pairs this run that already existed in the alias table." },
        "names_seen": { "type": "integer", "minimum": 0 },
        "rows_parsed": { "type": "integer", "minimum": 0 },
        "weeks_of_history_min": { "type": "integer", "minimum": 0 },
        "weeks_of_history_median": { "type": "number", "minimum": 0 }
      }
    }
  },
  "$defs": {
    "date": { "type": "string", "pattern": "^\\d{4}-\\d{2}-\\d{2}$", "description": "ISO calendar date, America/Los_Angeles civil date." },
    "datetime": { "type": "string", "pattern": "^\\d{4}-\\d{2}-\\d{2}T\\d{2}:\\d{2}:\\d{2}Z$" },
    "region_code": { "enum": ["R1", "R2", "R3", "R4", "R5", "R6"] },
    "water_id": { "type": "string", "pattern": "^cdfw-[0-9]+$", "description": "'cdfw-' + CDFW's own StockingWaterID (the stockid in the schedule's map links). Stable: it is CDFW's key, not ours." },
    "week_like": {
      "type": "object",
      "additionalProperties": false,
      "required": ["start", "end"],
      "properties": { "start": { "$ref": "#/$defs/date" }, "end": { "$ref": "#/$defs/date" } }
    },
    "week": {
      "type": "object",
      "additionalProperties": false,
      "required": ["start", "end", "label"],
      "properties": {
        "start": { "$ref": "#/$defs/date", "description": "Always a Sunday (CDFW's week runs Sunday..Saturday)." },
        "end": { "$ref": "#/$defs/date", "description": "Always start + 6 days (a Saturday)." },
        "label": { "type": "string", "pattern": "^week of \\d{4}-\\d{2}-\\d{2}$", "description": "Display form. Never shorten to a single day." }
      }
    },
    "plant": {
      "type": "object",
      "additionalProperties": false,
      "required": ["week", "species", "status", "first_observed_at", "last_observed_at"],
      "properties": {
        "week": { "$ref": "#/$defs/week" },
        "species": { "type": "string", "minLength": 1 },
        "status": {
          "enum": ["listed", "removed"],
          "description": "'listed': present on the most recent fresh page that covered this week. 'removed': CDFW listed it, then dropped it while the week was still inside the page's stated period (plants are 'subject to change'). Never inferred from a stale or failed fetch."
        },
        "first_observed_at": { "$ref": "#/$defs/datetime" },
        "last_observed_at": { "$ref": "#/$defs/datetime" }
      }
    },
    "water": {
      "type": "object",
      "additionalProperties": false,
      "required": ["id", "cdfw_stock_id", "name", "name_status", "slug", "counties", "region", "cdfw_map_url", "location", "last_listed_week", "plants"],
      "properties": {
        "id": { "$ref": "#/$defs/water_id" },
        "cdfw_stock_id": { "type": "integer", "minimum": 1 },
        "name": { "type": "string", "minLength": 1, "description": "Display name. From the alias table when reviewed; otherwise CDFW's most recent spelling, verbatim." },
        "name_status": { "enum": ["reviewed", "unreviewed"] },
        "slug": { "type": "string", "pattern": "^[a-z0-9]+(-[a-z0-9]+)*$", "description": "URL segment for the site's per-water page (site/water/<slug>/). Assigned once in the alias table and never changed." },
        "aliases": { "type": "array", "items": { "type": "string" }, "description": "Every spelling CDFW has published for this id." },
        "counties": { "type": "array", "minItems": 1, "items": { "type": "string", "minLength": 1 } },
        "region": { "$ref": "#/$defs/region_code", "description": "Region of the first listed county (CDFW's own county->region mapping)." },
        "cdfw_map_url": { "type": "string", "format": "uri" },
        "location": {
          "oneOf": [
            { "type": "null" },
            {
              "type": "object",
              "additionalProperties": false,
              "required": ["lat", "lon", "source"],
              "properties": {
                "lat": { "type": "number", "minimum": 32, "maximum": 43 },
                "lon": { "type": "number", "minimum": -125, "maximum": -113 },
                "source": { "type": "string", "minLength": 1, "description": "The licensed dataset the point came from. Coordinates are never guessed; absent a licensed source this is null." }
              }
            }
          ]
        },
        "last_listed_week": {
          "oneOf": [ { "type": "null" }, { "$ref": "#/$defs/week" } ],
          "description": "Newest week with status 'listed' whose start is <= source_week.start (i.e. not a future plant). Null if every observed plant is in the future."
        },
        "plants": {
          "type": "array",
          "minItems": 1,
          "items": { "$ref": "#/$defs/plant" },
          "description": "Every (week, species) ever observed for this water, oldest first. Append-only over time: an entry never disappears from a later snapshot."
        }
      }
    }
  }
}
